[
  {
    "rootfile": 143942,
    "callNumber": "STC 17884 copy 1",
    "pageNumber": "leaf A1 verso || leaf A2 recto",
    "multiPageSortOrder": 6,
    "title": "A game at chesse as it hath bine sundrey times acted at the Globe on the Banck side",
    "author": "Middleton, Thomas, d. 1627.",
    "imprintOrigin": "[1625?]",
    "bibId": 164514,
    "holdingsId": 158342,
    "lunaObjectId": 210663,
    "lunaImageId": 1214957,
    "lunaURL": "http://luna.folger.edu/luna/servlet/detail/FOLGERCM1~6~6~1214957~210663",
    "size4jpgURL": "http://luna.folger.edu:80/MediaManager/srvr?mediafile=/Size4/FOLGERCM1~6~6/647/143942.jpg",
    "size5jpgURL": "http://luna.folger.edu:80/MediaManager/srvr?mediafile=/JP2K/FOLGERCM1~6~6/647/143942.jp2&level=2&width=1677&height=1104",
    "size6jpgURL": "http://luna.folger.edu:80/MediaManager/srvr?mediafile=/JP2K/FOLGERCM1~6~6/647/143942.jp2&level=1&width=3354&height=2209",
    "size7jpgURL": "http://luna.folger.edu:80/MediaManager/srvr?mediafile=/JP2K/FOLGERCM1~6~6/647/143942.jp2&width=6709&height=4420",
    "dateCreated": "2016-12-06T16:36:24Z",
    "dateUpdated": "2016-12-06T16:36:24Z"
  },
  {
    "rootfile": 143943,
    "callNumber": "STC 17884 copy 1",
    "pageNumber": "leaf A2 verso || leaf A3 recto (page 1)",
    "multiPageSortOrder": 7,
    "title": "A game at chesse as it hath bine sundrey times acted at the Globe on the Banck side",
    "author": "Middleton, Thomas, d. 1627.",
    "imprintOrigin": "[1625?]",
    "bibId": 164514,
    "holdingsId": 158342,
    "lunaObjectId": 210662,
    "lunaImageId": 1214958,
    "lunaURL": "http://luna.folger.edu/luna/servlet/detail/FOLGERCM1~6~6~1214958~210662",
    "size4jpgURL": "http://luna.folger.edu:80/MediaManager/srvr?mediafile=/Size4/FOLGERCM1~6~6/647/143943.jpg",
    "size5jpgURL": "http://luna.folger.edu:80/MediaManager/srvr?mediafile=/JP2K/FOLGERCM1~6~6/647/143943.jp2&level=2&width=1681&height=1102",
    "size6jpgURL": "http://luna.folger.edu:80/MediaManager/srvr?mediafile=/JP2K/FOLGERCM1~6~6/647/143943.jp2&level=1&width=3363&height=2206",
    "size7jpgURL": "http://luna.folger.edu:80/MediaManager/srvr?mediafile=/JP2K/FOLGERCM1~6~6/647/143943.jp2&width=6727&height=4413",
    "dateCreated": "2016-12-06T16:36:24Z",
    "dateUpdated": "2016-12-06T16:36:24Z"
  },
  {
    "rootfile": 143944,
    "callNumber": "STC 17884 copy 1",
    "pageNumber": "leaf A3 verso (page 2) || leaf A4 recto (page 3)",
    "multiPageSortOrder": 8,
    "title": "A game at chesse as it hath bine sundrey times acted at the Globe on the Banck side",
    "author": "Middleton, Thomas, d. 1627.",
    "imprintOrigin": "[1625?]",
    "bibId": 164514,
    "holdingsId": 158342,
    "lunaObjectId": 210661,
    "lunaImageId": 1214959,
    "lunaURL": "http://luna.folger.edu/luna/servlet/detail/FOLGERCM1~6~6~1214959~210661",
    "size4jpgURL": "http://luna.folger.edu:80/MediaManager/srvr?mediafile=/Size4/FOLGERCM1~6~6/647/143944.jpg",
    "size5jpgURL": "http://luna.folger.edu:80/MediaManager/srvr?mediafile=/JP2K/FOLGERCM1~6~6/647/143944.jp2&level=2&width=1677&height=1100",
    "size6jpgURL": "http://luna.folger.edu:80/MediaManager/srvr?mediafile=/JP2K/FOLGERCM1~6~6/647/143944.jp2&level=1&width=3354&height=2201",
    "size7jpgURL": "http://luna.folger.edu:80/MediaManager/srvr?mediafile=/JP2K/FOLGERCM1~6~6/647/143944.jp2&width=6709&height=4404",
    "dateCreated": "2016-12-06T16:36:24Z",
    "dateUpdated": "2016-12-06T16:36:24Z"
  },
  {
    "rootfile": 143945,
    "callNumber": "STC 17884 copy 1",
    "pageNumber": "leaf A4 verso (page 4) || leaf B1 recto (page 5)",
    "multiPageSortOrder": 9,
    "title": "A game at chesse as it hath bine sundrey times acted at the Globe on the Banck side",
    "author": "Middleton, Thomas, d. 1627.",
    "imprintOrigin": "[1625?]",
    "bibId": 164514,
    "holdingsId": 158342,
    "lunaObjectId": 210660,
    "lunaImageId": 1214960,
    "lunaURL": "http://luna.folger.edu/luna/servlet/detail/FOLGERCM1~6~6~1214960~210660",
    "size4jpgURL": "http://luna.folger.edu:80/MediaManager/srvr?mediafile=/Size4/FOLGERCM1~6~6/647/143945.jpg",
    "size5jpgURL": "http://luna.folger.edu:80/MediaManager/srvr?mediafile=/JP2K/FOLGERCM1~6~6/647/143945.jp2&level=2&width=1674&height=1099",
    "size6jpgURL": "http://luna.folger.edu:80/MediaManager/srvr?mediafile=/JP2K/FOLGERCM1~6~6/647/143945.jp2&level=1&width=3349&height=2200",
    "size7jpgURL": "http://luna.folger.edu:80/MediaManager/srvr?mediafile=/JP2K/FOLGERCM1~6~6/647/143945.jp2&width=6698&height=4400",
    "dateCreated": "2016-12-06T16:36:24Z",
    "dateUpdated": "2016-12-06T16:36:25Z"
  },
  {
    "rootfile": 143946,
    "callNumber": "STC 17884 copy 1",
    "pageNumber": "leaf B1 verso (page 6) || leaf B2 recto (page 7)",
    "multiPageSortOrder": 10,
    "title": "A game at chesse as it hath bine sundrey times acted at the Globe on the Banck side",
    "author": "Middleton, Thomas, d. 1627.",
    "imprintOrigin": "[1625?]",
    "bibId": 164514,
    "holdingsId": 158342,
    "lunaObjectId": 210659,
    "lunaImageId": 1214961,
    "lunaURL": "http://luna.folger.edu/luna/servlet/detail/FOLGERCM1~6~6~1214961~210659",
    "size4jpgURL": "http://luna.folger.edu:80/MediaManager/srvr?mediafile=/Size4/FOLGERCM1~6~6/647/143946.jpg",
    "size5jpgURL": "http://luna.folger.edu:80/MediaManager/srvr?mediafile=/JP2K/FOLGERCM1~6~6/647/143946.jp2&level=2&width=1664&height=1093",
    "size6jpgURL": "http://luna.folger.edu:80/MediaManager/srvr?mediafile=/JP2K/FOLGERCM1~6~6/647/143946.jp2&level=1&width=3328&height=2186",
    "size7jpgURL": "http://luna.folger.edu:80/MediaManager/srvr?mediafile=/JP2K/FOLGERCM1~6~6/647/143946.jp2&width=6656&height=4372",
    "dateCreated": "2016-12-06T16:36:25Z",
    "dateUpdated": "2016-12-06T16:36:25Z"
  },
  {
    "rootfile": 143947,
    "callNumber": "STC 17884 copy 1",
    "pageNumber": "leaf B2 verso (page 8) || leaf B3 recto (page 9)",
    "multiPageSortOrder": 11,
    "title": "A game at chesse as it hath bine sundrey times acted at the Globe on the Banck side",
    "author": "Middleton, Thomas, d. 1627.",
    "imprintOrigin": "[1625?]",
    "bibId": 164514,
    "holdingsId": 158342,
    "lunaObjectId": 210658,
    "lunaImageId": 1214962,
    "lunaURL": "http://luna.folger.edu/luna/servlet/detail/FOLGERCM1~6~6~1214962~210658",
    "size4jpgURL": "http://luna.folger.edu:80/MediaManager/srvr?mediafile=/Size4/FOLGERCM1~6~6/647/143947.jpg",
    "size5jpgURL": "http://luna.folger.edu:80/MediaManager/srvr?mediafile=/JP2K/FOLGERCM1~6~6/647/143947.jp2&level=2&width=1674&height=1096",
    "size6jpgURL": "http://luna.folger.edu:80/MediaManager/srvr?mediafile=/JP2K/FOLGERCM1~6~6/647/143947.jp2&level=1&width=3349&height=2193",
    "size7jpgURL": "http://luna.folger.edu:80/MediaManager/srvr?mediafile=/JP2K/FOLGERCM1~6~6/647/143947.jp2&width=6698&height=4386",
    "dateCreated": "2016-12-06T16:36:25Z",
    "dateUpdated": "2016-12-06T16:36:25Z"
  }
]