[
  {
    "rootfile": 143937,
    "callNumber": "STC 17884 copy 1",
    "pageNumber": "front outside cover",
    "multiPageSortOrder": 1,
    "title": "A game at chesse as it hath bine sundrey times acted at the Globe on the Banck side",
    "author": "Middleton, Thomas, d. 1627.",
    "imprintOrigin": "[1625?]",
    "bibId": 164514,
    "holdingsId": 158342,
    "lunaObjectId": 210668,
    "lunaImageId": 1214952,
    "lunaURL": "http://luna.folger.edu/luna/servlet/detail/FOLGERCM1~6~6~1214952~210668",
    "size4jpgURL": "http://luna.folger.edu:80/MediaManager/srvr?mediafile=/Size4/FOLGERCM1~6~6/647/143937.jpg",
    "size5jpgURL": "http://luna.folger.edu:80/MediaManager/srvr?mediafile=/JP2K/FOLGERCM1~6~6/647/143937.jp2&level=2&width=1238&height=1568",
    "size6jpgURL": "http://luna.folger.edu:80/MediaManager/srvr?mediafile=/JP2K/FOLGERCM1~6~6/647/143937.jp2&level=1&width=2478&height=3137",
    "size7jpgURL": "http://luna.folger.edu:80/MediaManager/srvr?mediafile=/JP2K/FOLGERCM1~6~6/647/143937.jp2&width=4957&height=6274",
    "dateCreated": "2016-12-06T16:36:24Z",
    "dateUpdated": "2016-12-06T16:36:24Z"
  }
]