[
  {
    "rootfile": 143937,
    "callNumber": "STC 17884 copy 1",
    "pageNumber": "front outside cover",
    "multiPageSortOrder": 1,
    "title": "A game at chesse as it hath bine sundrey times acted at the Globe on the Banck side",
    "author": "Middleton, Thomas, d. 1627.",
    "imprintOrigin": "[1625?]",
    "bibId": 164514,
    "holdingsId": 158342,
    "lunaObjectId": 210668,
    "lunaImageId": 1214952,
    "lunaURL": "http://luna.folger.edu/luna/servlet/detail/FOLGERCM1~6~6~1214952~210668",
    "size4jpgURL": "http://luna.folger.edu:80/MediaManager/srvr?mediafile=/Size4/FOLGERCM1~6~6/647/143937.jpg",
    "size5jpgURL": "http://luna.folger.edu:80/MediaManager/srvr?mediafile=/JP2K/FOLGERCM1~6~6/647/143937.jp2&level=2&width=1238&height=1568",
    "size6jpgURL": "http://luna.folger.edu:80/MediaManager/srvr?mediafile=/JP2K/FOLGERCM1~6~6/647/143937.jp2&level=1&width=2478&height=3137",
    "size7jpgURL": "http://luna.folger.edu:80/MediaManager/srvr?mediafile=/JP2K/FOLGERCM1~6~6/647/143937.jp2&width=4957&height=6274",
    "dateCreated": "2016-12-06T16:36:24Z",
    "dateUpdated": "2016-12-06T16:36:24Z"
  },
  {
    "rootfile": 143938,
    "callNumber": "STC 17884 copy 1",
    "pageNumber": "front inside cover || front endleaf 1 recto",
    "multiPageSortOrder": 2,
    "title": "A game at chesse as it hath bine sundrey times acted at the Globe on the Banck side",
    "author": "Middleton, Thomas, d. 1627.",
    "imprintOrigin": "[1625?]",
    "bibId": 164514,
    "holdingsId": 158342,
    "lunaObjectId": 210667,
    "lunaImageId": 1214953,
    "lunaURL": "http://luna.folger.edu/luna/servlet/detail/FOLGERCM1~6~6~1214953~210667",
    "size4jpgURL": "http://luna.folger.edu:80/MediaManager/srvr?mediafile=/Size4/FOLGERCM1~6~6/647/143938.jpg",
    "size5jpgURL": "http://luna.folger.edu:80/MediaManager/srvr?mediafile=/JP2K/FOLGERCM1~6~6/647/143938.jp2&level=2&width=1679&height=1115",
    "size6jpgURL": "http://luna.folger.edu:80/MediaManager/srvr?mediafile=/JP2K/FOLGERCM1~6~6/647/143938.jp2&level=1&width=3359&height=2232",
    "size7jpgURL": "http://luna.folger.edu:80/MediaManager/srvr?mediafile=/JP2K/FOLGERCM1~6~6/647/143938.jp2&width=6718&height=4465",
    "dateCreated": "2016-12-06T16:36:24Z",
    "dateUpdated": "2016-12-06T16:36:24Z"
  },
  {
    "rootfile": 143939,
    "callNumber": "STC 17884 copy 1",
    "pageNumber": "front endleaf 1 verso || front endleaf 2 recto",
    "multiPageSortOrder": 3,
    "title": "A game at chesse as it hath bine sundrey times acted at the Globe on the Banck side",
    "author": "Middleton, Thomas, d. 1627.",
    "imprintOrigin": "[1625?]",
    "bibId": 164514,
    "holdingsId": 158342,
    "lunaObjectId": 210666,
    "lunaImageId": 1214954,
    "lunaURL": "http://luna.folger.edu/luna/servlet/detail/FOLGERCM1~6~6~1214954~210666",
    "size4jpgURL": "http://luna.folger.edu:80/MediaManager/srvr?mediafile=/Size4/FOLGERCM1~6~6/647/143939.jpg",
    "size5jpgURL": "http://luna.folger.edu:80/MediaManager/srvr?mediafile=/JP2K/FOLGERCM1~6~6/647/143939.jp2&level=2&width=1673&height=1112",
    "size6jpgURL": "http://luna.folger.edu:80/MediaManager/srvr?mediafile=/JP2K/FOLGERCM1~6~6/647/143939.jp2&level=1&width=3346&height=2225",
    "size7jpgURL": "http://luna.folger.edu:80/MediaManager/srvr?mediafile=/JP2K/FOLGERCM1~6~6/647/143939.jp2&width=6693&height=4452",
    "dateCreated": "2016-12-06T16:36:24Z",
    "dateUpdated": "2016-12-06T16:36:24Z"
  },
  {
    "rootfile": 14394,
    "callNumber": "STC 22313 copy 2",
    "pageNumber": "front endleaf 2v || front endleaf 3r",
    "multiPageSortOrder": 4,
    "title": "[King Richard II] The life and death of King Richard the second. With new additions of the Parliament scene, and the deposing of King Richard.",
    "author": "Shakespeare, William, 1564-1616.",
    "imprintOrigin": "1634",
    "bibId": 163923,
    "holdingsId": 157499,
    "lunaObjectId": 108701,
    "lunaImageId": 141640,
    "lunaURL": "http://luna.folger.edu/luna/servlet/detail/FOLGERCM1~6~6~141640~108701",
    "size4jpgURL": "http://luna.folger.edu:80/MediaManager/srvr?mediafile=/Size4/FOLGERCM1-6-NA/1072/014394.jpg",
    "size5jpgURL": "http://luna.folger.edu:80/MediaManager/srvr?mediafile=/JP2K/FOLGERCM1-6-NA/1072/014394.jp2&level=2&width=1767&height=1256",
    "size6jpgURL": "http://luna.folger.edu:80/MediaManager/srvr?mediafile=/JP2K/FOLGERCM1-6-NA/1072/014394.jp2&level=1&width=3534&height=2512",
    "size7jpgURL": "http://luna.folger.edu:80/MediaManager/srvr?mediafile=/JP2K/FOLGERCM1-6-NA/1072/014394.jp2&width=7068&height=5025",
    "dateCreated": "2014-12-30T17:31:14Z",
    "dateUpdated": "2014-12-30T17:31:14Z"
  },
  {
    "rootfile": 143940,
    "callNumber": "STC 17884 copy 1",
    "pageNumber": "front endleaf 2 verso || front endleaf 3 recto",
    "multiPageSortOrder": 4,
    "title": "A game at chesse as it hath bine sundrey times acted at the Globe on the Banck side",
    "author": "Middleton, Thomas, d. 1627.",
    "imprintOrigin": "[1625?]",
    "bibId": 164514,
    "holdingsId": 158342,
    "lunaObjectId": 210665,
    "lunaImageId": 1214955,
    "lunaURL": "http://luna.folger.edu/luna/servlet/detail/FOLGERCM1~6~6~1214955~210665",
    "size4jpgURL": "http://luna.folger.edu:80/MediaManager/srvr?mediafile=/Size4/FOLGERCM1~6~6/647/143940.jpg",
    "size5jpgURL": "http://luna.folger.edu:80/MediaManager/srvr?mediafile=/JP2K/FOLGERCM1~6~6/647/143940.jp2&level=2&width=1681&height=1112",
    "size6jpgURL": "http://luna.folger.edu:80/MediaManager/srvr?mediafile=/JP2K/FOLGERCM1~6~6/647/143940.jp2&level=1&width=3362&height=2225",
    "size7jpgURL": "http://luna.folger.edu:80/MediaManager/srvr?mediafile=/JP2K/FOLGERCM1~6~6/647/143940.jp2&width=6725&height=4452",
    "dateCreated": "2016-12-06T16:36:24Z",
    "dateUpdated": "2016-12-06T16:36:24Z"
  },
  {
    "rootfile": 143941,
    "callNumber": "STC 17884 copy 1",
    "pageNumber": "front endleaf 3 verso || leaf A1 recto",
    "multiPageSortOrder": 5,
    "title": "A game at chesse as it hath bine sundrey times acted at the Globe on the Banck side",
    "author": "Middleton, Thomas, d. 1627.",
    "imprintOrigin": "[1625?]",
    "bibId": 164514,
    "holdingsId": 158342,
    "lunaObjectId": 210664,
    "lunaImageId": 1214956,
    "lunaURL": "http://luna.folger.edu/luna/servlet/detail/FOLGERCM1~6~6~1214956~210664",
    "size4jpgURL": "http://luna.folger.edu:80/MediaManager/srvr?mediafile=/Size4/FOLGERCM1~6~6/647/143941.jpg",
    "size5jpgURL": "http://luna.folger.edu:80/MediaManager/srvr?mediafile=/JP2K/FOLGERCM1~6~6/647/143941.jp2&level=2&width=1665&height=1100",
    "size6jpgURL": "http://luna.folger.edu:80/MediaManager/srvr?mediafile=/JP2K/FOLGERCM1~6~6/647/143941.jp2&level=1&width=3330&height=2201",
    "size7jpgURL": "http://luna.folger.edu:80/MediaManager/srvr?mediafile=/JP2K/FOLGERCM1~6~6/647/143941.jp2&width=6661&height=4404",
    "dateCreated": "2016-12-06T16:36:24Z",
    "dateUpdated": "2016-12-06T16:36:24Z"
  }
]