[
  {
    "rootfile": 38759,
    "callNumber": "L.a.1",
    "pageNumber": "leaf 1 recto",
    "multiPageSortOrder": 1,
    "title": "Letter from Humphrey Adderley, Lincoln's Inn, to Walter Bagot",
    "author": "",
    "imprintOrigin": "1620 May 24",
    "bibId": 230544,
    "holdingsId": 310297,
    "lunaObjectId": 129775,
    "lunaImageId": 353152,
    "lunaURL": "http://luna.folger.edu/luna/servlet/detail/FOLGERCM1~6~6~353152~129775",
    "size4jpgURL": "http://luna.folger.edu:80/MediaManager/srvr?mediafile=/Size4/FOLGERCM1-6-NA/1168/038759.jpg",
    "size5jpgURL": "http://luna.folger.edu:80/MediaManager/srvr?mediafile=/JP2K/FOLGERCM1-6-NA/1168/038759.jp2&level=2&width=2150&height=3051",
    "size6jpgURL": "http://luna.folger.edu:80/MediaManager/srvr?mediafile=/JP2K/FOLGERCM1-6-NA/1168/038759.jp2&level=1&width=4301&height=6102",
    "size7jpgURL": "",
    "dateCreated": "2014-12-30T17:03:54Z",
    "dateUpdated": "2016-12-06T15:27:13Z"
  },
  {
    "rootfile": 38760,
    "callNumber": "L.a.1",
    "pageNumber": "leaf 1 verso || leaf 2 recto",
    "multiPageSortOrder": 2,
    "title": "Letter from Humphrey Adderley, Lincoln's Inn, to Walter Bagot",
    "author": "",
    "imprintOrigin": "1620 May 24",
    "bibId": 230544,
    "holdingsId": 310297,
    "lunaObjectId": 129776,
    "lunaImageId": 353161,
    "lunaURL": "http://luna.folger.edu/luna/servlet/detail/FOLGERCM1~6~6~353161~129776",
    "size4jpgURL": "http://luna.folger.edu:80/MediaManager/srvr?mediafile=/Size4/FOLGERCM1-6-NA/1168/038760.jpg",
    "size5jpgURL": "http://luna.folger.edu:80/MediaManager/srvr?mediafile=/JP2K/FOLGERCM1-6-NA/1168/038760.jp2&level=2&width=1541&height=1110",
    "size6jpgURL": "http://luna.folger.edu:80/MediaManager/srvr?mediafile=/JP2K/FOLGERCM1-6-NA/1168/038760.jp2&level=1&width=3082&height=2221",
    "size7jpgURL": "http://luna.folger.edu:80/MediaManager/srvr?mediafile=/JP2K/FOLGERCM1-6-NA/1168/038760.jp2&width=6165&height=4443",
    "dateCreated": "2014-12-30T17:03:55Z",
    "dateUpdated": "2016-12-06T15:27:15Z"
  },
  {
    "rootfile": 38761,
    "callNumber": "L.a.1",
    "pageNumber": "leaf 2 verso",
    "multiPageSortOrder": 3,
    "title": "Letter from Humphrey Adderley, Lincoln's Inn, to Walter Bagot",
    "author": "",
    "imprintOrigin": "1620 May 24",
    "bibId": 230544,
    "holdingsId": 310297,
    "lunaObjectId": 129777,
    "lunaImageId": 353170,
    "lunaURL": "http://luna.folger.edu/luna/servlet/detail/FOLGERCM1~6~6~353170~129777",
    "size4jpgURL": "http://luna.folger.edu:80/MediaManager/srvr?mediafile=/Size4/FOLGERCM1-6-NA/1168/038761.jpg",
    "size5jpgURL": "http://luna.folger.edu:80/MediaManager/srvr?mediafile=/JP2K/FOLGERCM1-6-NA/1168/038761.jp2&level=2&width=2151&height=3051",
    "size6jpgURL": "http://luna.folger.edu:80/MediaManager/srvr?mediafile=/JP2K/FOLGERCM1-6-NA/1168/038761.jp2&level=1&width=4302&height=6102",
    "size7jpgURL": "",
    "dateCreated": "2014-12-30T17:03:55Z",
    "dateUpdated": "2016-12-06T15:27:16Z"
  }
]